title,url,category,source,text_to_cluster,cluster
Tesla denies contacting headhunters to replace Musk,https://www.bbc.com/news/articles/cr4n94klqg9o,Business,Bbc,tesla deni contact headhunt replac musk electr car firm say report hunt successor absolut fals,1
Seven takeaways from US-Ukraine resources deal,https://www.bbc.com/news/articles/c5yg456mzn8o,Business,Bbc,seven takeaway usukrain resourc deal wont chang us assist ukrain three year war,1
Apple referred for possible criminal contempt investigation,https://www.bbc.com/news/articles/c62xv43xqq5o,Business,Bbc,appl refer possibl crimin contempt investig tech giant order 2021 allow greater competit open app store outsid payment option,1
Meta warns of 'worse' experience for European users,https://www.bbc.com/news/articles/czd3mey1ej2o,Business,Bbc,meta warn wors experi european user meta said neg impact could kick soon third quarter year,3
Seven takeaways from US-Ukraine resources deal,https://www.bbc.com/news/articles/c5yg456mzn8o,Business,Bbc,seven takeaway usukrain resourc deal wont chang us assist ukrain three year war,1
US and Ukraine sign long-awaited natural resources deal,https://www.bbc.com/news/articles/c5ypw7pn9q3o,Business,Bbc,us ukrain sign longawait natur resourc deal white hous push agreement prerequisit militari assist,1
Trump tells business chiefs he needs 'little bit of time' as US economy shrinks,https://www.bbc.com/news/articles/c807n4rnmjyo,Business,Bbc,trump tell busi chief need littl bit time us economi shrink us presid blame first quarterli gdp declin three year democrat predecessor,3
'We don't care': A defiant China looks beyond Trump's America,https://www.bbc.com/news/articles/cwy7jdn09lxo,Business,Bbc,dont care defiant china look beyond trump america chines export tell bbc us doesnt want good countri money buy,1
Deported gang members get second chance at call centre,https://www.bbc.com/news/articles/c93g2e332d9o,Business,Bbc,deport gang member get second chanc call centr mexican citi tijuana number firm employ peopl remov us,0
"Fifty years after the war, Vietnam faces a new US threat - tariffs",https://www.bbc.com/news/articles/cjewggl0yqeo,Business,Bbc,fifti year war vietnam face new us threat tariff south east asian countri path prosper uschina trade war could chang,1
US economy shrinks as firms import more ahead of tariffs,https://www.bbc.com/news/articles/cpwz9kl12l1o,Business,Bbc,us economi shrink firm import ahead tariff world largest economi contract annual pace 03 first three month 2025,3
Billionaire Isaacman takes big step toward leading Nasa,https://www.bbc.com/news/articles/c5yg30dlp1vo,Business,Bbc,billionair isaacman take big step toward lead nasa jare isaacman work elon musk approv key committe expect clear full senat vote,3
Xi's real test is not Trump's trade war,https://www.bbc.com/news/articles/cpq7y8vl55yo,Business,Bbc,xi real test trump trade war real battleground current trade war might china domest economi,3
Starbucks to hire more baristas in bid to win back customers,https://www.bbc.com/news/articles/cwy747g49ezo,Business,Bbc,starbuck hire barista bid win back custom move increas staff number come coffe shop giant continu see sale fall,0
"Border crossings, egg prices and jobs - Trump's 100 days speech fact-checked",https://www.bbc.com/news/articles/cy5rd35wg4ro,Business,Bbc,border cross egg price job trump 100 day speech factcheck bbc verifi look claim made us presid speech michigan,1
Richard Branson criticises Donald Trump's tariffs,https://www.bbc.com/news/articles/cq5w156y3jeo,Business,Bbc,richard branson criticis donald trump tariff sir richard branson told bbc want make london prosper everybodi,1
Playing with FIRE: How to quit work and retire in your 30s,https://www.bbc.com/reel/video/p09qwdp6/playing-with-fire-how-to-quit-work-and-retire-in-your-30s,Business,Bbc,play fire quit work retir 30 person financ strategi popular among millenni help quit job retir decad earli,1
Boomerang CEOs: Do they ever succeed?,https://www.bbc.com/reel/video/p0h9q7kj/boomerang-ceos-do-they-ever-succeed-,Business,Bbc,boomerang ceo ever succeed five year oust wework adam neumann want rebuy nowbankrupt busi,1
How industry leaders transformed their career,https://www.bbc.com/reel/video/p0h4hbs4/how-industry-leaders-transformed-their-career,Business,Bbc,industri leader transform career bbc katti kay spoken success changemak ask made pivot career,1
Women were the original beer brewers - what changed?,https://www.bbc.com/reel/video/p0gwgmz8/women-were-the-original-beer-brewers-what-changed-,Business,Bbc,women origin beer brewer chang today beer industri maledomin wasnt alway,1
How waiting alters our perception of time,https://www.bbc.com/reel/video/p09cdyyd/how-waiting-alters-our-perception-of-time,Business,Bbc,wait alter percept time expert advic get wait period,1
Do the super-rich 'deserve' their wealth?,https://www.bbc.com/reel/video/p0fv01m1/do-the-super-rich-deserve-their-wealth-,Business,Bbc,superrich deserv wealth cap billionair wealth inherit,1
Four simple hacks to succeed in every conversation,https://www.bbc.com/reel/video/p098mgm9/four-simple-hacks-to-succeed-in-every-conversation,Business,Bbc,four simpl hack succeed everi convers career coach choreograph chef dragon boat captain offer advic give critic feedback,1
Solo and hybrid work: Navigating our future and new normal,https://www.bbc.com/reel/video/p09p4p1r/solo-and-hybrid-work-navigating-our-future-and-new-normal,Business,Bbc,solo hybrid work navig futur new normal covid19 reshap way live work rethink solo work explor futur worklif,1
Can supersonic flight ever be sustainable?,https://www.bbc.com/reel/video/p0c5mvlh/can-supersonic-flight-ever-be-sustainable-,Business,Bbc,superson flight ever sustain new era quiet net zero superson airlin could revolutionis aviat industri,1
Commencement speech: The surprising pitfall of your passions,https://www.bbc.com/reel/video/p0fq5w2r/commencement-speech-the-surprising-pitfall-of-your-passions,Business,Bbc,commenc speech surpris pitfal passion student graduat us week commenc speech might lead question choic,1
A desk full of descriptions for your work colleagues,https://www.bbc.com/reel/video/p0d20p52/a-desk-full-of-descriptions-for-your-work-colleagues,Business,Bbc,desk full descript work colleagu long lost word youv wait describ colleagu,1
Veterinarian suicide rates are very high. Why?,https://www.bbc.com/reel/video/p0gkmzb8/veterinarian-suicide-rates-are-very-high-why-,Business,Bbc,veterinarian suicid rate high veterinarian profession commit suicid higher rate gener popul,1
ASMR: How whispering took over the internet,https://www.bbc.com/reel/video/p0d95c27/asmr-how-whispering-took-over-the-internet,Business,Bbc,asmr whisper took internet meet creator behind current asmr boom,1
"Canada will deal with Trump 'on our terms', Carney tells BBC",https://www.bbc.com/news/articles/c14xydjzn5eo,Business,Bbc,canada deal trump term carney tell bbc speak exclus bbc canada pm say visit us seriou discuss,1
Trump calls Bezos as Amazon says no plan to show tariff price rises,https://www.bbc.com/news/articles/cdxg7xpr2j0o,Business,Bbc,trump call bezo amazon say plan show tariff price rise donald trump call amazon founder jeff bezo complain plan compani said reject,3
Trump eases car tariffs after firms raised concerns,https://www.bbc.com/news/articles/c70zy5w983go,Business,Bbc,trump eas car tariff firm rais concern presid said move would give compani relief adjust suppli chain,3
Analysis:  Carney wants to lead a G7 fightback on Trump tariffs,https://www.bbc.com/news/articles/cx27d89z0qdo,Business,Bbc,analysi carney want lead g7 fightback trump tariff win canadian elect mark carney becom biggest econom forc us presid,1
How Spain powered back to life from unprecedented national blackout,https://www.bbc.com/news/articles/c175ykvjxyeo,Business,Bbc,spain power back life unpreced nation blackout howev diversifi spain energi mix blackout requir enorm effort get back run,1
"Malta's golden passport scheme breaks EU law, top court rules",https://www.bbc.com/news/articles/ceqrd8dpzd5o,Business,Bbc,malta golden passport scheme break eu law top court rule scheme let peopl becom citizen pay buy rent properti certain valu donat chariti,1
"Trainer prices will rise due to tariffs, says Adidas",https://www.bbc.com/news/articles/c93g20z7943o,Business,Bbc,trainer price rise due tariff say adida adida say trade tariff introduc presid donald trump lead price rise us consum,3
Prince Andrew's firm linked to controversial PPE millionaire,https://www.bbc.com/news/articles/c9vep0p877wo,Business,Bbc,princ andrew firm link controversi ppe millionair document show doug barrowmanlink compani own princ startup competit two year,1
Australian PM dismisses warning over AAA credit rating,https://www.bbc.com/news/articles/c70zy7x0xy9o,Business,Bbc,australian pm dismiss warn aaa credit rate high public spend put countri rate risk save found analyst said,3
"After 20 years, family favourite The Gruffalo set for new adventure",https://www.bbc.com/news/articles/cddejgv4rlgo,Arts/Culture/Celebrities,Bbc,20 year famili favourit gruffalo set new adventur author julia donaldson say spur write campaign revers declin children read,0
Lorde: 'Working with Charli XCX kicked me into opening up',https://www.bbc.com/news/articles/c0l05xx6ekdo,Arts/Culture/Celebrities,Bbc,lord work charli xcx kick open lord announc fourth album featur remix charli xcx acclaim brat,1
"After 20 years, family favourite The Gruffalo set for new adventure",https://www.bbc.com/news/articles/cddejgv4rlgo,Arts/Culture/Celebrities,Bbc,20 year famili favourit gruffalo set new adventur author julia donaldson say spur write campaign revers declin children read,0
Lorde: 'Working with Charli XCX kicked me into opening up',https://www.bbc.com/news/articles/c0l05xx6ekdo,Arts/Culture/Celebrities,Bbc,lord work charli xcx kick open lord announc fourth album featur remix charli xcx acclaim brat,1
Robert De Niro shows support for transgender daughter,https://www.bbc.com/news/articles/c8dg3pn24z0o,Arts/Culture/Celebrities,Bbc,robert de niro show support transgend daughter dont know big deal say us hollywood actor,3
Counter-terrorism police investigating Kneecap videos,https://www.bbc.com/news/articles/clyqe3v5jjdo,Arts/Culture/Celebrities,Bbc,counterterror polic investig kneecap video metropolitan polic say ground investig video,1
10 of the best TV shows to watch this May,https://www.bbc.com/culture/article/20250429-10-of-the-best-tv-shows-to-watch-this-may,Arts/Culture/Celebrities,Bbc,10 best tv show watch may tina fey new relationship comedi action drama creator lost return sarah jessica parker third season like,1
Robert De Niro shows support for transgender daughter,https://www.bbc.com/news/articles/c8dg3pn24z0o,Arts/Culture/Celebrities,Bbc,robert de niro show support transgend daughter dont know big deal say us hollywood actor,3
Counter-terrorism police investigating Kneecap videos,https://www.bbc.com/news/articles/clyqe3v5jjdo,Arts/Culture/Celebrities,Bbc,counterterror polic investig kneecap video metropolitan polic say ground investig video,1
10 of the best films of 2025 so far,https://www.bbc.com/culture/article/20250423-the-best-films-of-2025,Arts/Culture/Celebrities,Bbc,10 best film 2025 far bbc film critic caryn jame nichola barber pick cinema highlight year far brutal war epic ambiti period vampir drama,1
10 of the best TV shows of 2025 so far,https://www.bbc.com/culture/article/20250417-the-best-tv-shows-of-2025,Arts/Culture/Celebrities,Bbc,10 best tv show 2025 far latest season sever uk miniseri got world talk new hit medic show pick year greatest programm stream right,0
The true story of the first-ever 'rock star' chef,https://www.bbc.com/culture/article/20250428-how-19th-century-bad-boy-antonin-careme-made-food-rock-n-roll,Arts/Culture/Celebrities,Bbc,true stori firstev rock star chef new appl tv seri explor life socal king chef chef king shown wild enfant terribl blaze trail futur gener cook,1
Thunderbolts* is 'the greatest Marvel in years' ★★★★☆,https://www.bbc.com/culture/article/20250429-thunderbolts-film-review,Arts/Culture/Celebrities,Bbc,thunderbolt greatest marvel year latest superhero franchis scrappi scruffylook downtoearth fun charismat florenc pugh centr,1
Why Sinners has become a box-office sensation,https://www.bbc.com/culture/article/20250428-the-reason-sinners-has-become-a-true-box-office-sensation,Arts/Culture/Celebrities,Bbc,sinner becom boxoffic sensat ryan coogler vampir film extraordinari second weekend box offic victori wholli origin bigbudget film cinema landscap familiar franchis,1
Aldrich Ames: The most damaging double agent in US history,https://www.bbc.com/culture/article/20250424-how-aldrich-ames-became-the-uss-most-damaging-double-agent,Arts/Culture/Celebrities,Bbc,aldrich ame damag doubl agent us histori cia offic spent nearli decad sell secret soviet union lead death least 10 western agent 1994 bbc spoke one spi betray,1
The overlooked masterpiece full of coded messages about WW1,https://www.bbc.com/culture/article/20250423-the-masterpiece-full-of-coded-messages-about-ww1,Arts/Culture/Celebrities,Bbc,overlook masterpiec full code messag ww1 esoter pioneer paint lesserknown preraphaelit evelyn de morgan explor trauma mean war prefigur current fantasi art,1
The gory Shakespeare play that makes people faint,https://www.bbc.com/culture/article/20250422-the-gory-shakespeare-play-that-makes-people-faint,Arts/Culture/Celebrities,Bbc,gori shakespear play make peopl faint titu andronicu bard violent work new product set one extrem take yet rais question watch brutal,1
The fake Hitler diaries that fooled the press,https://www.bbc.com/culture/article/20250414-the-fake-hitler-diaries-that-fooled-rupert-murdoch,Arts/Culture/Celebrities,Bbc,fake hitler diari fool press april 1983 british newspap sunday time claim print extraordinari histor document fact forg diari extraordinari hoax,1
The men behind the Great Train Robbery,https://www.bbc.com/culture/article/20250410-the-men-behind-the-great-train-robbery,Arts/Culture/Celebrities,Bbc,men behind great train robberi twelv suspect put trial april 1964 decad later sever talk bbc notori heist,1
How the US dropped nuclear bombs on Spain in 1966 accident,https://www.bbc.com/culture/article/20250404-how-the-us-dropped-nuclear-bombs-on-spain-in-1966,Arts/Culture/Celebrities,Bbc,us drop nuclear bomb spain 1966 accid two plane collid three hydrogen bomb hit spanish villag one fell sea nearbi two year later villag talk bbc terrifi accid,1
How Bill Gates mapped out the internet era in 1993,https://www.bbc.com/culture/article/20250327-how-bill-gates-predicted-our-it-age-back-in-1993,Arts/Culture/Celebrities,Bbc,bill gate map internet era 1993 gate paul allen launch comput giant microsoft 50 year ago 1993 talk bbc onlin innov would defin 21st centuri,1
The true story of The Great Escape,https://www.bbc.com/culture/article/20250320-the-true-story-of-the-great-escape,Arts/Culture/Celebrities,Bbc,true stori great escap march 1944 76 offic broke german prisonerofwar camp 1977 key member escap team talk bbc mission hollywood film inspir,3
Jean-Luc Godard on the film that changed cinema,https://www.bbc.com/culture/article/20250313-jean-luc-godard-on-the-film-that-changed-cinema,Arts/Culture/Celebrities,Bbc,jeanluc godard film chang cinema stylish experiment breathless herald new era filmmak releas 65 year ago 1964 director told bbc broke everi rule could,1
'One to one' with John Lennon and Yoko Ono,https://www.bbc.com/reel/video/p0l3gdnp/-one-to-one-with-john-lennon-and-yoko-ono,Arts/Culture/Celebrities,Bbc,one one john lennon yoko ono bbc tom brook explor neverbeforeseen footag share person connect new documentari,1
Why Elton John burst into tears after recording a song,https://www.bbc.com/reel/video/p0kpwp60/why-elton-john-burst-into-tears-after-recording-a-song,Arts/Culture/Celebrities,Bbc,elton john burst tear record song musician explain heavi moment think lyric song forthcom album,1
Chris Pratt on having Arnold Schwarzenegger as his father-in-law,https://www.bbc.com/reel/video/p0kvc7t6/chris-pratt-on-having-schwarzenegger-as-his-father-in-law,Arts/Culture/Celebrities,Bbc,chri pratt arnold schwarzenegg fatherinlaw us actor reveal ritual famou fatherinlaw includ let win chess,1
The strange origins of daylight savings time,https://www.bbc.com/reel/video/p0kwwlv7/the-strange-origins-of-daylight-savings-time,Arts/Culture/Celebrities,Bbc,strang origin daylight save time insect hunter new zealand name georg hudson respons clock chang twice year,1
Brooke Shields on mature beauty,https://www.bbc.com/reel/video/p0ks2trm/brooke-shields-on-mature-beauty,Arts/Culture/Celebrities,Bbc,brook shield matur beauti katti kay talk actress brook shield life career age,1
Green Man Festival silent on Kneecap inclusion,https://www.bbc.com/news/articles/c4grdqlk7l5o,Arts/Culture/Celebrities,Bbc,green man festiv silent kneecap inclus call remov rapper lineup sever venu cancel gig,1
Film festival celebrates region's textile history,https://www.bbc.com/news/articles/cx20zg0n52jo,Arts/Culture/Celebrities,Bbc,film festiv celebr region textil histori alchemi festiv hawick includ film look role textil border,1
Woman completes granddaughter's unfinished novel,https://www.bbc.com/news/articles/c078rm3zde7o,Arts/Culture/Celebrities,Bbc,woman complet granddaught unfinish novel lorrain martin promis granddaught would finish book,1
BBC Proms to return to Bristol Beacon,https://www.bbc.com/news/articles/c4g2dr0k68mo,Arts/Culture/Celebrities,Bbc,bbc prom return bristol beacon classic orchestra concert return citi august,1
Mod clothing exhibition set to open in Brighton,https://www.bbc.com/news/articles/crm30mv30myo,Arts/Culture/Celebrities,Bbc,mod cloth exhibit set open brighton crowd mod fashion style 195866 open brighton museum 10 may,1
'Playing Celine Dion on stage is a lot of pressure',https://www.bbc.com/news/articles/cgqv54330dlo,Arts/Culture/Celebrities,Bbc,play celin dion stage lot pressur lauren drew 32 port talbot play star titaniqu music london west end,3
More Kneecap gigs cancelled after 'kill your MP' controversy,https://www.bbc.com/news/articles/c8x8n5kn80qo,Arts/Culture/Celebrities,Bbc,kneecap gig cancel kill mp controversi ticket site irish rap band gig hamburg berlin cologn confirm summer show longer go ahead,1
Stone lion sculpture gets facelift to match twin,https://www.bbc.com/news/articles/c2kv7pnx28qo,Arts/Culture/Celebrities,Bbc,stone lion sculptur get facelift match twin lion gate weelsbi wood grimsbi face chang match partner,1
When are the 2025 local elections and who can vote?,https://www.bbc.com/news/articles/cvgdwwrdz3xo,Politics,Bbc,2025 local elect vote voter part england elect councillor mayor 1 may,1
Counter-terrorism police investigating Kneecap videos,https://www.bbc.com/news/articles/clyqe3v5jjdo,Politics,Bbc,counterterror polic investig kneecap video metropolitan polic say ground investig video,1
Bin dispute goes to May Day mediation talks,https://www.bbc.com/news/articles/cwyqrny47rno,Politics,Bbc,bin disput goe may day mediat talk talk thursday see concili servic aca includ negoti first time,0
"'Unacceptable' to question Supreme Court gender ruling, says minister",https://www.bbc.com/news/articles/cjwvx1z3l2qo,Politics,Bbc,unaccept question suprem court gender rule say minist shabana mahmood said judg uk highest court provid legal clariti,3
When are the 2025 local elections and who can vote?,https://www.bbc.com/news/articles/cvgdwwrdz3xo,Politics,Bbc,2025 local elect vote voter part england elect councillor mayor 1 may,1
Labour defends net-zero policies after Blair criticism,https://www.bbc.com/news/articles/cq80974l402o,Politics,Bbc,labour defend netzero polici blair critic former pm sir toni blair say limit fossil fuel doom fail new approach need,1
MPs watchdog probes Reeves' theatre tickets declaration,https://www.bbc.com/news/articles/c2lzqr8055go,Politics,Bbc,mp watchdog probe reev theatr ticket declar bbc told chancellor accept donat add mp regist interest,1
Counter-terrorism police investigating Kneecap videos,https://www.bbc.com/news/articles/clyqe3v5jjdo,Politics,Bbc,counterterror polic investig kneecap video metropolitan polic say ground investig video,1
Badenoch accuses government of failure on grooming gangs,https://www.bbc.com/news/articles/cx2vmdgdddyo,Politics,Bbc,badenoch accus govern failur groom gang govern face grow demand reveal area run groom gang inquir,1
Government not taking climate seriously - advisers,https://www.bbc.com/news/articles/cvgpey03pnno,Politics,Bbc,govern take climat serious advis govern made littl progress prepar uk rise temperatur climat watchdog ccc say,3
Sex offenders to be denied asylum rights in new law,https://www.bbc.com/news/articles/cvg7q0e77exo,Politics,Bbc,sex offend deni asylum right new law asylum seeker place sex offend regist deni right stay uk,0
Milkshakes and lattes could be covered by sugar tax,https://www.bbc.com/news/articles/cpwzekdznldo,Politics,Bbc,milkshak latt could cover sugar tax tax would appli manufactur milkbas drink dairybas substitut plan,1
What photo ID will you need to vote in the local elections?,https://www.bbc.com/news/explainers-64877005,Politics,Bbc,photo id need vote local elect everyon vote person may local elect england must show valid photo id,1
Is there a local election in my area and where can I vote?,https://www.bbc.com/news/articles/cd925jk27k0o,Politics,Bbc,local elect area vote find whether elect near thursday vote use lookup tool,1
Who's standing in the Runcorn by-election?,https://www.bbc.com/news/articles/c8epkwk2we3o,Politics,Bbc,who stand runcorn byelect total 15 peopl vy next mp runcorn helsbi cheshir,1
Watch: What's at stake in these local elections?,https://www.bbc.com/news/videos/cevdmjvke2po,Politics,Bbc,watch what stake local elect watch what stake local elect,1
Is Welsh Labour turning away from Keir Starmer?,https://www.bbc.com/news/articles/cg41d2k9p4do,Politics,Bbc,welsh labour turn away keir starmer could frustrat welsh uk labour boil ask polit editor gareth lewi,1
FA bars transgender women from women's football,https://www.bbc.com/sport/football/articles/cz01z4rdx4no,Sports,Bbc,fa bar transgend women women footbal transgend women longer abl play women footbal england follow polici chang footbal associ,1
Europa League build-up: Man Utd and Spurs set for season-defining semi-finals,https://www.bbc.com/sport/football/live/crkx5rlzz0pt,Sports,Bbc,europa leagu buildup man utd spur set seasondefin semifin england look set begin defin year one inexperienc pace attack past two decad,1
Why more than £100m rests on Man Utd winning Europa League,https://www.bbc.com/sport/football/articles/c789ezrv2kzo,Sports,Bbc,100m rest man utd win europa leagu england look set begin defin year one inexperienc pace attack past two decad,1
James unsure of future after Lakers play-off loss,https://www.bbc.com/sport/basketball/articles/czjnljyz7zvo,Sports,Bbc,jame unsur futur laker playoff loss england look set begin defin year one inexperienc pace attack past two decad,1
The Arctic Circle giant-killers out to upset Postecoglou again,https://www.bbc.com/sport/football/articles/cedy4xe2e32o,Sports,Bbc,arctic circl giantkil upset postecogl england look set begin defin year one inexperienc pace attack past two decad,1
Into the Lions' den - spiritual San Mames awaits Man Utd,https://www.bbc.com/sport/football/articles/ce82l4ek442o,Sports,Bbc,lion den spiritu san mame await man utd england look set begin defin year one inexperienc pace attack past two decad,1
'A talent that comes along every 50 years' - 'genius' Yamal steals show,https://www.bbc.com/sport/football/articles/c1eg12y2qpdo,Sports,Bbc,talent come along everi 50 year geniu yamal steal show england look set begin defin year one inexperienc pace attack past two decad,1
Five unsung heroes of Chelsea's WSL title success,https://www.bbc.com/sport/football/articles/c0l060rxgj5o,Sports,Bbc,five unsung hero chelsea wsl titl success england look set begin defin year one inexperienc pace attack past two decad,1
'Those muscles gone' - Haney & Garcia clash in New York,https://www.bbc.com/sport/boxing/articles/cz6dzje991xo,Sports,Bbc,muscl gone haney garcia clash new york england look set begin defin year one inexperienc pace attack past two decad,1
How teenager George broke through Chelsea's £1bn squad,https://www.bbc.com/sport/football/articles/c3r83389eqno,Sports,Bbc,teenag georg broke chelsea 1bn squad england look set begin defin year one inexperienc pace attack past two decad,1
Messi's Miami thrashed in Champions Cup semi-final,https://www.bbc.com/sport/football/articles/c078r7ex21yo,Sports,Bbc,messi miami thrash champion cup semifin england look set begin defin year one inexperienc pace attack past two decad,1
Fan critical after falling from stand at MLB game,https://www.bbc.com/sport/baseball/articles/c367d6zd7p7o,Sports,Bbc,fan critic fall stand mlb game england look set begin defin year one inexperienc pace attack past two decad,1
World Snooker Championship - live text,https://www.bbc.com/sport/snooker/live/cx200xzgj8pt,Sports,Bbc,world snooker championship live text england look set begin defin year one inexperienc pace attack past two decad,1
England set to start key year with callow attack,https://www.bbc.com/sport/cricket/articles/czrvz714m08o,Sports,Bbc,england set start key year callow attack england look set begin defin year one inexperienc pace attack past two decad,1
'All that matters is showing I deserve to be here',https://www.bbc.com/sport/mixed-martial-arts/articles/ckg2w9pz13eo,Sports,Bbc,matter show deserv barri jone run rule fight ryan garcia devin haney take place weekend,1
