title,url,category,source,text_to_cluster,cluster
"Early detection, treatment crucial interventions for childhood cancer",https://www.theindependent.co.zw/lifestyle-amp-arts/article/200038603/early-detection-treatment-crucial-interventions-for-childhood-cancer,Arts/Culture/Celebrities,Independent,earli detect treatment crucial intervent childhood cancer rate surviv childhood cancer around 80 highincom countri low 20 low middleincom countri,1
Local school leaves mark on global culinary scene,https://www.theindependent.co.zw/lifestyle-amp-arts/article/200038602/local-school-leaves-mark-on-global-culinary-scene,Arts/Culture/Celebrities,Independent,local school leav mark global culinari scene zimbabw place group b yco alongsid countri mexico austria franc nepal sweden south korea sri lanka unit arab emir wale,1
Sofar unites music lovers worldwide,https://www.theindependent.co.zw/lifestyle-amp-arts/article/200038601/sofar-unites-music-lovers-worldwide,Arts/Culture/Celebrities,Independent,sofar unit music lover worldwid songwrit compos nichola mutuwa well exodu chauk fun tastic 4 complet lineup,1
Most causes of toothache preventable,https://www.theindependent.co.zw/lifestyle-amp-arts/article/200038774/most-causes-of-toothache-preventable,Arts/Culture/Celebrities,Independent,caus toothach prevent prevent gum diseas tooth decay reli three factor said good oral hygien healthi diet regular dental checkup,3
Music Connects Africa’s 2025 accelerator programme open,https://www.theindependent.co.zw/lifestyle-amp-arts/article/200037994/music-connects-africas-2025-accelerator-programme-open,Arts/Culture/Celebrities,Independent,music connect africa 2025 acceler programm open first cohort script bar incub compris 75 creativ zimbabw 25 creativ uk,1
Early detection and patient-centred care important for cancer treatment,https://www.theindependent.co.zw/lifestyle-amp-arts/article/200038773/early-detection-and-patient-centred-care-important-for-cancer-treatment,Arts/Culture/Celebrities,Independent,earli detect patientcentr care import cancer treatment symptom leukaemia children might includ persist fever easi bruis prolong bleed frequent infect,1
"Medicines, lifestyle changes help in managing narcolepsy",https://www.theindependent.co.zw/lifestyle-amp-arts/article/200037694/medicines-lifestyle-changes-help-in-managing-narcolepsy,Arts/Culture/Celebrities,Independent,medicin lifestyl chang help manag narcolepsi explain friend workmat supervisor narcolepsi often manag success medic lifestyl adjust,0
Coping or cracking: Psychological toll of Zim’s informal economy,https://www.theindependent.co.zw/business-digest/article/200041173/coping-or-cracking-psychological-toll-of-zims-informal-economy,Business,Independent,cope crack psycholog toll zim inform economi inform economi protect million peopl financi ruin,3
Procurement key performance indicators simplified analysis (I),https://www.theindependent.co.zw/business-digest/article/200041172/procurement-key-performance-indicators-simplified-analysis-i,Business,Independent,procur key perform indic simplifi analysi key perform indic kpi key provis indepth analysi procur function impact busi impact chang overtim,3
ZSE CEO eyes 25% market cap to GDP,https://www.theindependent.co.zw/business-digest/article/200041165/zse-ceo-eyes-25-market-cap-to-gdp,Business,Independent,zse ceo eye 25 market cap gdp justin bgoni chief execut offic zse told businessdigest ratio figur would reach 20 25 period place bours,1
Telecoms boom as firms invest in new assets,https://www.theindependent.co.zw/business-digest/article/200041166/telecoms-boom-as-firms-invest-in-new-assets,Business,Independent,telecom boom firm invest new asset zida said week telecom sector rapidli transit datadriven servic mobil internet data traffic continu rise,3
Harnessing the power of procurement audits,https://www.theindependent.co.zw/business-digest/article/200040904/harnessing-the-power-of-procurement-audits,Business,Independent,har power procur audit due mani move part procur easi rogu spend seep crack lead fraud seriou complianc infract,1
"Africa’s first AI factory: What it means for Zim, continent",https://www.theindependent.co.zw/business-digest/article/200040903/africas-first-ai-factory-what-it-means-for-zim-continent,Business,Independent,africa first ai factori mean zim contin figur make anyon stop think without access right infrastructur contin truli compet global stage,0
"Rethinking medical aid, pensions in Zim",https://www.theindependent.co.zw/business-digest/article/200040902/rethinking-medical-aid-pensions-in-zim,Business,Independent,rethink medic aid pension zim medic aid scheme zimbabw also lost much sheen,0
Embracing future in post-letterbox epoch,https://www.theindependent.co.zw/business-digest/article/200040901/embracing-future-in-post-letterbox-epoch,Business,Independent,embrac futur postletterbox epoch access email address smartphon mobil number longer luxuri,0
"AfDB to disburse US$1,4m to Zim",https://www.theindependent.co.zw/business-digest/article/200040899/afdb-to-disburse-us14m-to-zim,Business,Independent,afdb disburs us14m zim accord afdb implement progress report us862 million loan disburs april 4 project slate complet two month time,1
"Solgas on expansion drive, to double production in Hwange",https://www.theindependent.co.zw/business-digest/article/200040898/solgas-on-expansion-drive-to-double-production-in-hwange,Business,Independent,solga expans drive doubl product hwang expans follow old mutual zimbabw us73 million invest 2021 construct 53mw solar plant 100hectar site cross mabal,3
KMH injects over US$50m into ZimAlloys,https://www.theindependent.co.zw/business-digest/article/200040897/kmh-injects-over-us50m-into-zimalloys,Business,Independent,kmh inject us50m zimalloy zimalloy manag director deric dube told businessdigest week substanti portion capit outlay use procur equip among prioriti,0
Zimre Holdings set to refocus capex to strategic investments,https://www.theindependent.co.zw/business-digest/article/200040896/zimre-holdings-set-to-refocus-capex-to-strategic-investments,Business,Independent,zimr hold set refocu capex strateg invest eagl reit project commenc last year expect complet 2026,3
"Afreximbank defies global economic headwinds with record US$973,5m profit in 2024",https://www.theindependent.co.zw/business-digest/article/200040785/afreximbank-defies-global-economic-headwinds-with-record-us9735m-profit-in-2024,Business,Independent,afreximbank defi global econom headwind record us9735m profit 2024 zimbabw one 54 african member state particip afreximbank,3
We will halt rapid mushrooming of service stations in Harare: Mafume,https://www.theindependent.co.zw/business-digest/article/200040659/we-will-halt-rapid-mushrooming-of-service-stations-in-harare-mafume,Business,Independent,halt rapid mushroom servic station harar mafum high time mix peopl peopl outsid realign,1
Counterfeit crisis a big threat to economy,https://www.theindependent.co.zw/business-digest/article/200040656/counterfeit-crisis-a-big-threat-to-economy,Business,Independent,counterfeit crisi big threat economi consum council zimbabw chief execut offic rose mpofu note counterfeit challeng uniqu zimbabw said global crisi,3
Huge progress in reducing unclaimed shares,https://www.theindependent.co.zw/business-digest/article/200040655/huge-progress-in-reducing-unclaimed-shares,Business,Independent,huge progress reduc unclaim share mutorogodo ad reason behind low number claim mostli due slow submiss claim due stringent know client requir,1
Canadian firm LARC makes headway in lithium mining,https://www.theindependent.co.zw/business-digest/article/200040654/canadian-firm-larc-makes-headway-in-lithium-mining,Business,Independent,canadian firm larc make headway lithium mine present sharehold firm disclos commenc drill zimbabw asset locat mashonaland central januari,1
"Banks automate, phase out traditional roles",https://www.theindependent.co.zw/business-digest/article/200040653/banks-automate-phase-out-traditional-roles,Business,Independent,bank autom phase tradit role baz believ digit shift present employe opportun upskil transit new role better suit digit economi,3
Gold investor’s Nasdaq listing plan hits snag,https://www.theindependent.co.zw/business-digest/article/200040652/gold-investors-nasdaq-listing-plan-hits-snag,Business,Independent,gold investor nasdaq list plan hit snag merger expect form us609 million entiti would trade stock nasdaq secondlargest american stock exchang,1
CABS strikes fresh deals to bolster Zim economy,https://www.theindependent.co.zw/business-digest/article/200040376/cabs-strikes-fresh-deals-to-bolster-zim-economy,Business,Independent,cab strike fresh deal bolster zim economi period loan advanc rose 1437 us19203 million major support commerci industri sector,3
Labour rights under threat as company woes persist,https://www.theindependent.co.zw/business-digest/article/200040375/labour-rights-under-threat-as-company-woes-persist,Business,Independent,labour right threat compani woe persist interview businessdigest alpz chairperson caleb muchech said compani must prioritis fair labour practic,0
Choppies records US$1m loss on sale of Zim unit,https://www.theindependent.co.zw/business-digest/article/200040372/choppies-records-us1m-loss-on-sale-of-zim-unit,Business,Independent,choppi record us1m loss sale zim unit accord choppi unaudit interim financi result six month end decemb 31 2024 supermarket chain zimbabw unit cash drain,3
Zim banks explore syndicate financing amid cash crunch,https://www.theindependent.co.zw/business-digest/article/200040373/zim-banks-explore-syndicate-financing-amid-cash-crunch,Business,Independent,zim bank explor syndic financ amid cash crunch liquid crunch caus hawkish monetari fiscal polici meant preserv artifici valu zig,1
Old Mutual Zim invests US$20m in tech upgrade,https://www.theindependent.co.zw/business-digest/article/200040374/old-mutual-zim-invests-us20m-in-tech-upgrade,Business,Independent,old mutual zim invest us20m tech upgrad compani chief execut offic samuel matseket told businessdigest invest would support growth initi across variou busi line,3
Caledonia executives strike gold,https://www.theindependent.co.zw/business-digest/article/200040356/caledonia-executives-strike-gold,Business,Independent,caledonia execut strike gold bank group past year cull 500 accord estim zibawu predict bloodbath 2025 oper respond techdriven upheav,1
Old Mutual investments skew towards alternatives,https://www.theindependent.co.zw/business-digest/article/200040105/old-mutual-investments-skew-towards-alternatives,Business,Independent,old mutual invest skew toward altern financi year end decemb 31 2024 omz chairperson kumbirayi katsand said credit line support key sector economi,3
Arrest journalists at your own peril: US ambassador,https://www.theindependent.co.zw/local-news/article/200041417/arrest-journalists-at-your-own-peril-us-ambassador,Politics,Independent,arrest journalist peril us ambassador realli happi starlink think lot room starlink grow,1
Short-term inflation spike fears mount,https://www.theindependent.co.zw/local-news/article/200041416/short-term-inflation-spike-fears-mount,Politics,Independent,shortterm inflat spike fear mount week analyst warn without tighter monetari disciplin gap may widen,1
Construction boom spurs Willdale,https://www.theindependent.co.zw/local-news/article/200041408/construction-boom-spurs-willdale,Politics,Independent,construct boom spur willdal capex capit expenditur budget us4 million mainli fund new allweath plant,1
"Trevor Ncube spreads wings, launches new consultancy",https://www.theindependent.co.zw/local-news/article/200041404/trevor-ncube-spreads-wings-launches-new-consultancy,Politics,Independent,trevor ncube spread wing launch new consult ncube emphasis commun oneway flow messag,1
"US$200 million wiped off Zim mining industry... power cuts, slumping prices ravage first quarter",https://www.theindependent.co.zw/local-news/article/200041164/us200-million-wiped-off-zim-mining-industry-power-cuts-slumping-prices-ravage-first-quarter,Politics,Independent,us200 million wipe zim mine industri power cut slump price ravag first quarter kwesu urg author prioritis zimbabw product sector mine distribut avail electr,0
"US in dramatic policy, strategy shift",https://www.theindependent.co.zw/local-news/article/200041163/us-in-dramatic-policy-strategy-shift,Politics,Independent,us dramat polici strategi shift shift mark signific recalibr washington diplomat engag harar accord us ambassador zimbabw pamela tremont,1
"‘Super-rich’ coalition fights Mnangagwa road dualisation... US$11m project threatens Highlands’ iconic Musasa trees, climate",https://www.theindependent.co.zw/local-news/article/200041162/super-rich-coalition-fights-mnangagwa-road-dualisation-us11m-project-threatens-highlands-iconic-musasa-trees-climate,Politics,Independent,superrich coalit fight mnangagwa road dualis us11m project threaten highland icon musasa tree climat blueprint drive mnangagwa vision 2030 ambit,1
Ex-judge’s journey from bench to holding security to account,https://www.theindependent.co.zw/local-news/article/200041160/ex-judges-journey-from-bench-to-holding-security-to-account,Politics,Independent,exjudg journey bench hold secur account lead constitut bodi compos individu drawn variou sector divers profession background,3
"Govt clarifies US$1,9 billion Kuvimba deal",https://www.theindependent.co.zw/local-news/article/200041161/govt-clarifies-us19-billion-kuvimba-deal,Politics,Independent,govt clarifi us19 billion kuvimba deal mif chief execut john mangudya said bond 10year tenur threeyear grace period issu loan treasuri,3
ZimRe targets Ivory Coast in fresh push for African deals,https://www.theindependent.co.zw/local-news/article/200041153/zimre-targets-ivory-coast-in-fresh-push-for-african-deals,Politics,Independent,zimr target ivori coast fresh push african deal zhl chief oper offic chakanyuka nziradzemhuka,1
"Political gamble attracts mixed feelings... NTA proposal rebuked, embraced",https://www.theindependent.co.zw/local-news/article/200041116/political-gamble-attracts-mixed-feelings-nta-proposal-rebuked-embraced,Politics,Independent,polit gambl attract mix feel nta propos rebuk embrac ccc rip apart divis saw chamisa leav new leader take charg,1
Padenga's golden transformation powers record results,https://www.theindependent.co.zw/local-news/article/200040911/padengas-golden-transformation-powers-record-results,Politics,Independent,padenga golden transform power record result importantli compani return metric skyrocket return equiti increas 33 932,1
Bard Santner gears up for Seeff Zimbabwe Diaspora Property Showcase in Texas,https://www.theindependent.co.zw/local-news/article/200040908/bard-santner-gears-up-for-seeff-zimbabwe-diaspora-property-showcase-in-texas,Politics,Independent,bard santner gear seeff zimbabw diaspora properti showcas texa us event part strategi provid platform channel zimbabwean us investor seek come countri region,0
Mutapa makes US$56m move for CSC revival,https://www.theindependent.co.zw/local-news/article/200040895/mutapa-makes-us56m-move-for-csc-revival,Politics,Independent,mutapa make us56m move csc reviv said mif fund would deploy settl debt upgrad infrastructur restock cattl ranch reviv oper,1
Insurance regulator in firing line over billions...medical insurers condemn Ipec in pushback over new Bill,https://www.theindependent.co.zw/local-news/article/200040894/insurance-regulator-in-firing-line-over-billionsmedical-insurers-condemn-ipec-in-pushback-over-new-bill,Politics,Independent,insur regul fire line billionsmed insur condemn ipec pushback new bill blast ipec watch pension fund insur firm slip perpetu turmoil,3
Investors shun Zim’s US$ indexed stock exchange,https://www.theindependent.co.zw/local-news/article/200040893/investors-shun-zims-us-indexed-stock-exchange,Politics,Independent,investor shun zim us index stock exchang zse chief execut offic justin bgoni said victoria fall intern financi centr vfifc could help address limit current capit market,3
Contractors amenable to land deals with govt to settle debts,https://www.theindependent.co.zw/local-news/article/200040892/contractors-amenable-to-land-deals-with-govt-to-settle-debts,Politics,Independent,contractor amen land deal govt settl debt 2023 independ report govern project threat contractor contempl pull due unpaid due,1
Economists differ in opinion as fragile economy disentangles,https://www.theindependent.co.zw/local-news/article/200040890/economists-differ-in-opinion-as-fragile-economy-disentangles,Politics,Independent,economist differ opinion fragil economi disentangl govern face enorm challeng reviv economi prevent total collaps,3
Zim targets informal workers in new safety scheme,https://www.theindependent.co.zw/local-news/article/200040891/zim-targets-informal-workers-in-new-safety-scheme,Politics,Independent,zim target inform worker new safeti scheme govern provid grain household need alloc 10kg per person per month,1
Medical insurers scour Africa as regulatory move sends tremors,https://www.theindependent.co.zw/local-news/article/200040889/medical-insurers-scour-africa-as-regulatory-move-sends-tremors,Politics,Independent,medic insur scour africa regulatori move send tremor south africa regul medic scheme council medic scheme cm specialis statutori bodi report depart health,0
Belarus eyes tractor and bus assembly deal in boost to Zim ties,https://www.theindependent.co.zw/local-news/article/200040884/belarus-eyes-tractor-and-bus-assembly-deal-in-boost-to-zim-ties,Politics,Independent,belaru eye tractor bu assembl deal boost zim tie mr karankevich describ meet major step forward strengthen bilater relat expand practic cooper,1
Stockbroking firms in eye of storm as Zim taps harder on the tax front,https://www.theindependent.co.zw/local-news/article/200040877/stockbroking-firms-in-eye-of-storm-as-zim-taps-harder-on-the-tax-front,Politics,Independent,stockbrok firm eye storm zim tap harder tax front commiss account 80 revenu volumedepend advisori sponsor broker fee grow institut demand,1
Zim diaspora could provide a path towards national renewal,https://www.theindependent.co.zw/local-news/article/200040647/zim-diaspora-could-provide-a-path-towards-national-renewal,Politics,Independent,zim diaspora could provid path toward nation renew substanti portion gross domest product gdp,1
Govt reviews cost of doing business  for IPPs,https://www.theindependent.co.zw/local-news/article/200040645/govt-reviews-cost-of-doing-business-for-ipps,Politics,Independent,govt review cost busi ipp oversubscrib confer organis standard collabor energi power develop ministri,0
Collaborate to beneficiate lithium: Mines ministry,https://www.theindependent.co.zw/local-news/article/200040643/collaborate-to-beneficiate-lithium-mines-ministry,Politics,Independent,collabor benefici lithium mine ministri mukodzani urg compani submit benefici plan part licens process,1
Tender system overhaul meant to disarm corrupt looters: Praz CEO...more firewalls lined up to flash out shady deals,https://www.theindependent.co.zw/local-news/article/200040644/tender-system-overhaul-meant-to-disarm-corrupt-looters-praz-ceomore-firewalls-lined-up-to-flash-out-shady-deals,Politics,Independent,tender system overhaul meant disarm corrupt looter praz ceomor firewal line flash shadi deal continu encourag busi regist foster competit environ benefit stakehold,3
Sunshine Tour hails FBC Zim Open,https://www.theindependent.co.zw/sport/article/200041435/sunshine-tour-hails-fbc-zim-open,Sports,Independent,sunshin tour hail fbc zim open least 144 golfer across globe expect take part tournament includ least 17 local golfer,1
FBC Zim Open in cancer treatment drive,https://www.theindependent.co.zw/sport/article/200041434/fbc-zim-open-in-cancer-treatment-drive,Sports,Independent,fbc zim open cancer treatment drive year countri flagship event alway channel effort toward junior golf develop,1
FBC Zim Open bigger and better,https://www.theindependent.co.zw/sport/article/200041433/fbc-zim-open-bigger-and-better,Sports,Independent,fbc zim open bigger better fourth year row one countri top financi institut retain titl sponsorship event,3
Hollick set to defend FBC Zim Open title,https://www.theindependent.co.zw/sport/article/200041401/hollick-set-to-defend-fbc-zim-open-title,Sports,Independent,hollick set defend fbc zim open titl standout perform seventhplac finish zambia mopani open,1
ZHL delight at Zim Open,https://www.theindependent.co.zw/sport/article/200041176/zhl-delight-at-zim-open,Sports,Independent,zhl delight zim open zhl stranger sponsor sport event countri involv sport genr past,1
Zim juniors eye World Cup qualifier,https://www.theindependent.co.zw/sport/article/200041175/zim-juniors-eye-world-cup-qualifier,Sports,Independent,zim junior eye world cup qualifi total 15 countri take part annual continent championship junior golfer,1
Lady Sables eye  strong Rugby Africa  Cup Qualifiers finish,https://www.theindependent.co.zw/sport/article/200040943/lady-sables-eye-strong-rugby-africa-cup-qualifiers-finish,Sports,Independent,ladi sabl eye strong rugbi africa cup qualifi finish enter tournament rank lowest among four compet nation zimbabw got tournament fli start 468 win host ivori coast,1
FBC Zim Open tees off for charity,https://www.theindependent.co.zw/sport/article/200040906/fbc-zim-open-tees-off-for-charity,Sports,Independent,fbc zim open tee chariti came launch 2025 edit sunshin tour sanction event held royal harar golf club monday,1
FBC Zim Open dreams of DP World Tour,https://www.theindependent.co.zw/sport/article/200040871/fbc-zim-open-dreams-of-dp-world-tour,Sports,Independent,fbc zim open dream dp world tour zoc happi growth tournament sinc relaunch 2010 believ event go attain dp world tour statu,1
The best NBA draft picks ever,https://www.theindependent.co.zw/sport/article/200040940/the-best-nba-draft-picks-ever,Sports,Independent,best nba draft pick ever 5 championship 2 final mvp cement statu alltim great duncan,1
Zim ladies team second at regional tourney,https://www.theindependent.co.zw/sport/article/200040665/zim-ladies-team-second-at-regional-tourney,Sports,Independent,zim ladi team second region tourney zimbabw finish tournament gross total 490 two best score three day 40 stroke behind south africa 450,1
Women’s football in sponsorship adventure,https://www.theindependent.co.zw/sport/article/200040651/womens-football-in-sponsorship-adventure,Sports,Independent,women footbal sponsorship adventur ad hoc committe task promot zwpsl secur sponsorship deal support growth develop women footbal zimbabw,0
All set for Masvingo Golf Tournament,https://www.theindependent.co.zw/sport/article/200040650/all-set-for-masvingo-golf-tournament,Sports,Independent,set masvingo golf tournament competit open men women regist hna make fantast opportun local golfer showcas skill,1
Krog finishes as highest ranked Zim on Sunshine Tour,https://www.theindependent.co.zw/sport/article/200040389/krog-finishes-as-highest-ranked-zim-on-sunshine-tour,Sports,Independent,krog finish highest rank zim sunshin tour secondplac finish season stand shaun norri receiv r200 000 bonu use hyundai tucson one year,1
Shijie Li basks in Mawegu triumph,https://www.theindependent.co.zw/sport/article/200040388/shijie-li-basks-in-mawegu-triumph,Sports,Independent,shiji li bask mawegu triumph li finish second manicaland amateur well matabeleland amateur keegan shutt tournament,1
CBZ boost for Zim chess,https://www.theindependent.co.zw/sport/article/200040371/cbz-boost-for-zim-chess,Sports,Independent,cbz boost zim chess mark third consecut year cbz bank partner zimbabw chess feder zcf titl sponsor,1
Zim crick team set for thrilling winter season,https://www.theindependent.co.zw/sport/article/200040107/zim-crick-team-set-for-thrilling-winter-season,Sports,Independent,zim crick team set thrill winter season triseri sandwich two test match pit chevron protea follow number black cap,1
Chatora takes part in historic South Africa Open in Durban courtesy of Bard Santner’s Golf Challenge,https://www.theindependent.co.zw/sport/article/200040016/chatora-takes-part-in-historic-south-africa-open-in-durban-courtesy-of-bard-santners-golf-challenge,Sports,Independent,chatora take part histor south africa open durban courtesi bard santner golf challeng sinc launch octob 2024 bard santner road sa challeng held,3
Zim ladies set for Southern Region All-Africa Challenge,https://www.theindependent.co.zw/sport/article/200039826/zim-ladies-set-for-southern-region-all-africa-challenge,Sports,Independent,zim ladi set southern region allafrica challeng zimbabw ladi golf union zlgu announc team statement social media platform yesterday,1
ICZ charity golf day heads for Bulawayo,https://www.theindependent.co.zw/sport/article/200039827/icz-charity-golf-day-heads-for-bulawayo,Sports,Independent,icz chariti golf day head bulawayo cure zimbabw first charit children hospit countri 18 bed three oper room outpati clinic,0
Shutt rules the roost at Julius Robinson Golf Tournament,https://www.theindependent.co.zw/sport/article/200039524/shutt-rules-the-roost-at-julius-robinson-golf-tournament,Sports,Independent,shutt rule roost juliu robinson golf tournament tournament play wingat park golf club harar total 120 golfer particip tournament,1
Nomads Mashonaland tees off for impact,https://www.theindependent.co.zw/sport/article/200039523/nomads-mashonaland-tees-off-for-impact,Sports,Independent,nomad mashonaland tee impact 116 player compris 105 mashonaland nomad three prospect seven guest one visit nomad,1
ZimHeart hosts golf fundraiser,https://www.theindependent.co.zw/sport/article/200039510/zimheart-hosts-golf-fundraiser,Sports,Independent,zimheart host golf fundrais golf event schedul take place march 21 2025 chapman golf club,1
