title,url,category,source,text_to_cluster,cluster
Stunning goals and incredible drama - Barca & Inter deliver match for the ages,https://www.bbc.com/sport/football/articles/c7vnggzlmgjo,Sports,Bbc,stun goal incred drama barca inter deliv match age barri jone run rule fight ryan garcia devin haney take place weekend,1
Lord's to host final of 2026 Women's T20 World Cup,https://www.bbc.com/sport/cricket/articles/c98gvp0ljn6o,Sports,Bbc,lord host final 2026 women t20 world cup barri jone run rule fight ryan garcia devin haney take place weekend,1
How Chelsea extended dynasty with latest WSL title,https://www.bbc.com/sport/football/articles/cp91eje3jm2o,Sports,Bbc,chelsea extend dynasti latest wsl titl barri jone run rule fight ryan garcia devin haney take place weekend,1
Rui dropped by New Zealand for Pacific Four Series,https://www.bbc.com/sport/rugby-union/articles/c99p89285n4o,Sports,Bbc,rui drop new zealand pacif four seri barri jone run rule fight ryan garcia devin haney take place weekend,1
Ex-West Ham boss Lopetegui named Qatar manager,https://www.bbc.com/sport/football/articles/c1eg576jee2o,Sports,Bbc,exwest ham boss lopetegui name qatar manag barri jone run rule fight ryan garcia devin haney take place weekend,1
"Garcia, Haney and Inoue to fight in 72-hour feast",https://www.bbc.com/sport/boxing/articles/c1wd1lxy358o,Sports,Bbc,garcia haney inou fight 72hour feast barri jone run rule fight ryan garcia devin haney take place weekend,1
The WSL invincibles? Chelsea eye records after sealing another title,https://www.bbc.com/sport/football/articles/c4g7vyj7zr0o,Sports,Bbc,wsl invinc chelsea eye record seal anoth titl legendari captain willi john mcbride feel caelan dori best candid lead british irish lion australia summer,2
"'Times have changed, one clip can earn an England call-up'",https://www.bbc.com/sport/cricket/articles/cj0z3np26y8o,Sports,Bbc,time chang one clip earn england callup legendari captain willi john mcbride feel caelan dori best candid lead british irish lion australia summer,2
Is snooker 'dying' in Scotland? Or is it just 'different'?,https://www.bbc.com/sport/snooker/articles/c2lzrw2kxx4o,Sports,Bbc,snooker die scotland differ legendari captain willi john mcbride feel caelan dori best candid lead british irish lion australia summer,2
Carson 'one of the people you need around' - Walker,https://www.bbc.com/sport/football/articles/c0m9yl2wk0do,Sports,Bbc,carson one peopl need around walker legendari captain willi john mcbride feel caelan dori best candid lead british irish lion australia summer,2
Rao makes surprise FIA return as Ben Sulayem advisor,https://www.bbc.com/sport/formula1/articles/cg41dpkxyqyo,Sports,Bbc,rao make surpris fia return ben sulayem advisor legendari captain willi john mcbride feel caelan dori best candid lead british irish lion australia summer,2
Flintoff TV show refugee makes Lancs Second XI debut,https://www.bbc.com/sport/cricket/articles/c209l4jx97ro,Sports,Bbc,flintoff tv show refuge make lanc second xi debut legendari captain willi john mcbride feel caelan dori best candid lead british irish lion australia summer,2
Lions legend McBride backs Ireland's Doris for captaincy,https://www.bbc.com/sport/rugby-union/articles/c1k41gex840o,Sports,Bbc,lion legend mcbride back ireland dori captainci legendari captain willi john mcbride feel caelan dori best candid lead british irish lion australia summer,2
Pop icon Jones keeps Williams' title hopes on track,https://www.bbc.com/sport/snooker/articles/c3dk7vy18kgo,Sports,Bbc,pop icon jone keep william titl hope track photo ultrarunn sophi power breastfeed race went viral spark campaign chang,1
Sinner considered quitting during doping case,https://www.bbc.com/sport/tennis/articles/c99p8jrnv7jo,Sports,Bbc,sinner consid quit dope case photo ultrarunn sophi power breastfeed race went viral spark campaign chang,1
"NFL fine Falcons and coach £262,000 for prank call",https://www.bbc.com/sport/american-football/articles/clyw9ezgdnpo,Sports,Bbc,nfl fine falcon coach 262000 prank call photo ultrarunn sophi power breastfeed race went viral spark campaign chang,1
"Suryavanshi, 14, only going to get better - Dravid",https://www.bbc.com/sport/cricket/articles/cdjl08r7lxko,Sports,Bbc,suryavanshi 14 go get better dravid photo ultrarunn sophi power breastfeed race went viral spark campaign chang,1
Rodrygo considering Real Madrid exit - Thursday's gossip,https://www.bbc.com/sport/football/articles/c1me13gkdvjo,Sports,Bbc,rodrygo consid real madrid exit thursday gossip photo ultrarunn sophi power breastfeed race went viral spark campaign chang,1
'I want to get under their skin' - arch-pest Pollock aims for Leinster,https://www.bbc.com/sport/rugby-union/articles/c4g83dn185ro,Sports,Bbc,want get skin archpest pollock aim leinster photo ultrarunn sophi power breastfeed race went viral spark campaign chang,1
The runner who went viral and sparked a campaign for change for women,https://www.bbc.com/sport/athletics/articles/crm3py4jdnno,Sports,Bbc,runner went viral spark campaign chang women photo ultrarunn sophi power breastfeed race went viral spark campaign chang,1
How rejection fuelled Mourinho's second Champions League triumph,https://www.bbc.com/sport/football/articles/cdxnr6510vqo,Sports,Bbc,reject fuell mourinho second champion leagu triumph gloucestershir captain cameron bancroft australian intern ambit,1
"The life, loss and legacy of Kevin Campbell",https://www.bbc.com/sport/football/articles/cy0yq8287weo,Sports,Bbc,life loss legaci kevin campbel gloucestershir captain cameron bancroft australian intern ambit,1
Blood brothers - bonds and betrayal on a rugby pitch,https://www.bbc.com/sport/rugby-union/articles/cqjd1p98l4jo,Sports,Bbc,blood brother bond betray rugbi pitch gloucestershir captain cameron bancroft australian intern ambit,1
Inside the doping deal for tennis' world number one,https://www.bbc.com/sport/tennis/articles/cy5ny6lx5dqo,Sports,Bbc,insid dope deal tenni world number one gloucestershir captain cameron bancroft australian intern ambit,0
How does Daniel Levy run Tottenham - and would he ever leave?,https://www.bbc.com/sport/football/articles/cr53l53g793o,Sports,Bbc,daniel levi run tottenham would ever leav gloucestershir captain cameron bancroft australian intern ambit,1
'Like a Jason Bourne movie' - how Afghan women's team fled Taliban,https://www.bbc.com/sport/cricket/articles/cx2k1z7zg8do,Sports,Bbc,like jason bourn movi afghan women team fled taliban gloucestershir captain cameron bancroft australian intern ambit,1
Why Arsenal can still reach Champions League final,https://www.bbc.com/sport/football/articles/cwy6lx1x8dxo,Sports,Bbc,arsen still reach champion leagu final gloucestershir captain cameron bancroft australian intern ambit,1
The numbers behind Chelsea's latest WSL title,https://www.bbc.com/sport/football/articles/cedyjexwnwqo,Sports,Bbc,number behind chelsea latest wsl titl gloucestershir captain cameron bancroft australian intern ambit,0
Will Ferrari turn their season around?,https://www.bbc.com/sport/formula1/articles/c9qwd5xwyx3o,Sports,Bbc,ferrari turn season around gloucestershir captain cameron bancroft australian intern ambit,1
Who are the big winners & losers from the NFL Draft?,https://www.bbc.com/sport/american-football/articles/cn8vq77xqzxo,Sports,Bbc,big winner loser nfl draft gloucestershir captain cameron bancroft australian intern ambit,1
'Why hit a single when you can hit six?' - the making of a teen IPL star,https://www.bbc.com/sport/cricket/articles/cx2wvqd3jnzo,Sports,Bbc,hit singl hit six make teen ipl star gloucestershir captain cameron bancroft australian intern ambit,1
Discover the BBC's best sports podcasts,https://www.bbc.com/sounds/category/sport?sort=popular,Sports,Bbc,discov bbc best sport podcast copyright 2025 bbc bbc respons content extern site,2
More from BBC News,https://www.bbc.com/news,Sports,Bbc,bbc news copyright 2025 bbc bbc respons content extern site,2
Where and how to watch BBC News,https://www.bbc.com/news/world-radio-and-tv-14563857,Sports,Bbc,watch bbc news copyright 2025 bbc bbc respons content extern site,2
Premier League,https://www.bbc.com/sport/football/premier-league,Sports,Bbc,premier leagu copyright 2025 bbc bbc respons content extern site,2
European Football,https://www.bbc.com/sport/football/european,Sports,Bbc,european footbal copyright 2025 bbc bbc respons content extern site,2
Instagram,https://www.instagram.com/bbcsport/,Sports,Bbc,instagram copyright 2025 bbc bbc respons content extern site,2
TikTok,https://www.tiktok.com/@bbcsport,Sports,Bbc,tiktok copyright 2025 bbc bbc respons content extern site,2
Facebook,https://www.facebook.com/BBCSPORT,Sports,Bbc,facebook copyright 2025 bbc bbc respons content extern site,2
X,https://twitter.com/BBCSport,Sports,Bbc,x copyright 2025 bbc bbc respons content extern site,2
YouTube,https://www.youtube.com/channel/UCW6-BQWFA70Dyyc7ZpZ9Xlg,Sports,Bbc,youtub copyright 2025 bbc bbc respons content extern site,2
DJ Joe wins Carling Black Label Clash title,https://dailynews.co.zw/dj-joe-wins-carling-black-label-clash-title/,Arts/Culture/Celebrities,Dailynews,dj joe win carl black label clash titl ashley moyo senior lifestyl writer amoyodailynewscozwdj joseph isaac popularli known dj joe say win nation carl black label,1
Reprographic Rights Organisation of Zimbabwe launched...book piracy days numbered,https://dailynews.co.zw/org-launched-to-fight-book-piracy/,Arts/Culture/Celebrities,Dailynews,reprograph right organis zimbabw launchedbook piraci day number tinash nekatistaff writerth reprograph right organis zimbabw rroz task manag reprograph right behalf author publish,0
Jamaican star Dwayno’sromance with Zim continues,https://dailynews.co.zw/jamaican-star-dwaynosromance-with-zim-continues/,Arts/Culture/Celebrities,Dailynews,jamaican star dwayno sromanc zim continu ashley moyosenior lifestyl writermoyoadailynewscozwjamaican dancehal star dwayn dwayno forrest endur relationship set continu novemb 2 mbare netbal complex,1
Sulu dates Cresta Oasis Hotel,https://dailynews.co.zw/sulu-dates-cresta-oasis-hotel/,Arts/Culture/Celebrities,Dailynews,sulu date cresta oasi hotel dendera artist sulumani chimbetu simpli known sulu headlin afro fusion night concert tonight cresta oasi hotel apart,1
SA gospel legend Moholo dies aged 65,https://dailynews.co.zw/sa-gospel-legend-moholo-dies-aged-65/,Arts/Culture/Celebrities,Dailynews,sa gospel legend moholo die age 65 veteran south african gospel artist solomon molokoan popularli known solli moholo die age 65 manag,0
Jacaranda Music Festival kicks off today,https://dailynews.co.zw/jacaranda-music-festival-kicks-off-today/,Arts/Culture/Celebrities,Dailynews,jacaranda music festiv kick today anesu mirisawuentertain writermirisawuadailynewscozwth longawait jacaranda music festiv kick today thornpark polo club capit promis unforgett experi,1
Diamond Platnumz to ignite Kadoma,https://dailynews.co.zw/diamond-platnumz-to-ignite-kadoma/,Arts/Culture/Celebrities,Dailynews,diamond platnumz ignit kadoma entertain writer intern renown bongo flava artist diamond platnumz expect jet countri today much anticip kadoma music,1
"Hector Foya, Qounfuzed join forces",https://dailynews.co.zw/hector-foya-qounfuzed-join-forces/,Arts/Culture/Celebrities,Dailynews,hector foya qounfuz join forc progress chayastaff writerchayadailynewscozwsouth africabas zimbabwean artist hector foya team awardwin qounfuz singl titl foreign vybz accord,1
Baba Harare wows fans in Ruwa,https://dailynews.co.zw/baba-harare-wows-fans-in-ruwa/,Arts/Culture/Celebrities,Dailynews,baba harar wow fan ruwa thembinkosi nyathilifestyl writernyathitdailynewscozwj musician braveman chizvino aka baba harar put remark act ruwa weekendth gener singer,1
BCC pumps US$300kinto Byo Arts Festival,https://dailynews.co.zw/bcc-pumps-us300kinto-byo-arts-festival/,Arts/Culture/Celebrities,Dailynews,bcc pump us300kinto byo art festiv jeffrey muvundusisouthern editorth bulawayo citi father final resolv fund bulawayo art festiv tune us300 000,1
US-donor cuts worry life assurance sector,https://dailynews.co.zw/us-donor-cuts-worry-life-assurance-sector/,Business,Dailynews,usdonor cut worri life assur sector ,3
Milk output up 3pct in Q1,https://dailynews.co.zw/milk-output-up-3pct-in-q1/,Business,Dailynews,milk output 3pct q1 ,1
CBZ declares US$10m dividend,https://dailynews.co.zw/cbz-declares-us10m-dividend/,Business,Dailynews,cbz declar us10m dividend accord group chief legal counsel govern offic rumbidzayi jakanani dividend would paid sharehold regist close busi may 9 2025 payment expect take place may 15 2025 jakanani said,3
Govt cushions wheat farmers,https://dailynews.co.zw/govt-cushions-wheat-farmers/,Business,Dailynews,govt cushion wheat farmer ,1
Vast eyes new concessions. . . as Zimbabwe releases company gems after 15-years,https://dailynews.co.zw/vast-eyes-new-concessions-as-zimbabwe-releases-company-gems-after-15-years/,Business,Dailynews,vast eye new concess zimbabw releas compani gem 15year ,0
Byo pushes for more air traffic,https://dailynews.co.zw/byo-pushes-for-more-air-traffic/,Business,Dailynews,byo push air traffic ,1
"Think outside the box, entrepreneurs told",https://dailynews.co.zw/think-outside-the-box-entrepreneurs-told/,Business,Dailynews,think outsid box entrepreneur told ,1
Econet wins big at ZITF 2025,https://dailynews.co.zw/econet-wins-big-at-zitf-2025/,Business,Dailynews,econet win big zitf 2025 econet largest technolog telecom compani zimbabw also best zimbabwean ict exhibit award zimbabwean exhibit best themat represent award experienti zimbabwean exhibit award 2025 edit zitf held theme industrialis craft integr econom landscap,0
"Khayah proposes delisting, seeks shareholder nod",https://dailynews.co.zw/khayah-proposes-delisting-seeks-shareholder-nod/,Business,Dailynews,khayah propos delist seek sharehold nod ,1
BCC mulls solar farms on cemeteries,https://dailynews.co.zw/bcc-mulls-solar-farms-on-cemeteries/,Business,Dailynews,bcc mull solar farm cemeteri ,1
BCC courts private land developers,https://dailynews.co.zw/bcc-courts-private-land-developers/,Politics,Dailynews,bcc court privat land develop bulawayo citi council bcc seek privat investor develop partner largescal hous project address citi grow hous,1
Farmers urged to embrace insurance,https://dailynews.co.zw/farmers-urged-to-embrace-insurance/,Politics,Dailynews,farmer urg embrac insur insur council zimbabw icz intensifi awar campaign agricultur insur ensur farmer insur recov,0
"Gutu East, Insiza North by-elections date set",https://dailynews.co.zw/gutu-east-insiza-north-by-elections-date-set/,Politics,Dailynews,gutu east insiza north byelect date set presid emmerson mnangagwa proclaim june 14 date parliamentari byelect gutu insiza north constituenciesth byelect occas,1
Zim risks losing out on carbon credits,https://dailynews.co.zw/zim-risks-losing-out-on-carbon-credits/,Politics,Dailynews,zim risk lose carbon credit zimbabw risk miss global carbon credit market opportun due public ignor limit effort demystifi climat chang,3
Ema sounds alarm on wetlands destruction,https://dailynews.co.zw/ema-sounds-alarm-on-wetlands-destruction/,Politics,Dailynews,ema sound alarm wetland destruct environment manag agenc ema express deep concern rampant construct build wetland warn trend,0
Granny duped US$2k by ‘fake’ agent,https://dailynews.co.zw/granny-duped-us2k-by-fake-agent/,Politics,Dailynews,granni dupe us2k fake agent 65yearold woman allegedli dupe us2 000 suspect bogu travel agent samantha chiedza gumbo oper travel,1
Zvimba RDC employee loses promotion bid,https://dailynews.co.zw/zvimba-rdc-employee-loses-promotion-bid/,Politics,Dailynews,zvimba rdc employe lose promot bid zvimba rural district council rdc employe sought high court relief confirm right upgrad grade,0
Man loses R300k in suspected forex fraud,https://dailynews.co.zw/man-loses-r300k-in-suspected-forex-fraud/,Politics,Dailynews,man lose r300k suspect forex fraud harar man lost r300 000 suspect fraudster learnmor jonga promis exchang amount us16 000,1
Zimbabweans top SA illegal entry attempts,https://dailynews.co.zw/zimbabweans-top-sa-illegal-entry-attempts/,Politics,Dailynews,zimbabwean top sa illeg entri attempt zimbabwean identifi lead individu attempt illeg gain entri south africa reveal 2025,1
Fake jobs fraudster convicted,https://dailynews.co.zw/fake-jobs-fraudster-convicted/,Politics,Dailynews,fake job fraudster convict 23yearold man bulawayo allegedli deceiv sever individu fals claim could secur job collect variou amount,1
Kaindu seeks first away win,https://dailynews.co.zw/kaindu-seeks-first-away-win/,Sports,Dailynews,kaindu seek first away win highland head coach kelvin kaindu aim first away win season afternoon side take,1
Jonah Queens aim high,https://dailynews.co.zw/jonah-queens-aim-high/,Sports,Dailynews,jonah queen aim high emmanuel marambecentenarybas northern region women footbal leagu newcom jonah queen set sight promot countri top flight,1
Scottland sink Herentals,https://dailynews.co.zw/scottland-sink-herentals/,Sports,Dailynews,scottland sink herent cloud fusir rufaro stadiumscottland 0 1herent colleg 0 0scottland end threegam winless run hardfought onenil win spirit herent colleg,3
. . . as MWOS reclaim top spot,https://dailynews.co.zw/as-mwos-reclaim-top-spot/,Sports,Dailynews,mwo reclaim top spot mwo fc 0 1manica diamond 1 1mwo fc reclaim pole posit castl lager premier soccer leagu log stand battl back,1
China-bound relay team gets boost,https://dailynews.co.zw/china-bound-relay-team-gets-boost/,Sports,Dailynews,chinabound relay team get boost emmanuel marambechief sport writerzimbabw 4x400m relay team receiv major boost ahead upcom world athlet relay top chines,1
"Bullets, N’ombeyawora clash",https://dailynews.co.zw/bullets-nombeyawora-clash/,Sports,Dailynews,bullet n ombeyawora clash emmanuel marambearmi outfit cranborn bullet host log leader n ombeyawora commando barrack highlight today northern region soccer leagu nrsl,1
FC Platinum add to CAPS United woes. . . as Yadah stun Ngezi Platinum,https://dailynews.co.zw/fc-platinum-add-to-caps-united-woes-as-yadah-stun-ngezi-platinum/,Sports,Dailynews,fc platinum add cap unit woe yadah stun ngezi platinum cloud fusir emmanuel marambecap unit woe continu mount thandolwenkosi brace rufaro stadium yesterday condemn struggl harar,1
Bosso edge Lithium Boys,https://dailynews.co.zw/bosso-edge-lithium-boys/,Sports,Dailynews,bosso edg lithium boy bulawayo giant highland maintain unbeaten record home turf edg bikita miner onenil excit premier soccer,1
US$50 000 for Castle Tankard . . . Ideal View pre-race favourite in 16-strong field,https://dailynews.co.zw/us50-000-for-castle-tankard-ideal-view-pre-race-favourite-in-16-strong-field/,Sports,Dailynews,us50 000 castl tankard ideal view prerac favourit 16strong field emmanuel marambechief sport writerth 2023 winner ideal view favourit year edit countri premier hors race,0
Mhaka shines in Dubai,https://dailynews.co.zw/mhaka-shines-in-dubai/,Sports,Dailynews,mhaka shine dubai cloud fusireseason athlet godwin simbarash mhaka rais countri flag high scoop four gold medal two bronz,1
"Early diagnosis, treatment of haemophilia important",https://www.theindependent.co.zw/lifestyle-amp-arts/article/200040905/early-diagnosis-treatment-of-haemophilia-important,Arts/Culture/Celebrities,Independent,earli diagnosi treatment haemophilia import cima health group doctor hellen manyau explain world haemophilia day commemor yesterday observ annual rais,0
"Healthy beginnings, fragile systems: Antenatal care should become a national priority in Zim",https://www.theindependent.co.zw/lifestyle-amp-arts/article/200040664/healthy-beginnings-fragile-systems-antenatal-care-should-become-a-national-priority-in-zim,Arts/Culture/Celebrities,Independent,healthi begin fragil system antenat care becom nation prioriti zim import chirara said mother keep schedul postnat care clinic appoint birth babi,3
Fond farewell for Coventry,https://www.theindependent.co.zw/lifestyle-amp-arts/article/200040663/fond-farewell-for-coventry,Arts/Culture/Celebrities,Independent,fond farewel coventri secur presid 49 vote first round vote 144th ioc session costa navarino greec,1
High cholesterol levels could cause serious health issues,https://www.theindependent.co.zw/lifestyle-amp-arts/article/200040391/high-cholesterol-levels-could-cause-serious-health-issues,Arts/Culture/Celebrities,Independent,high cholesterol level could caus seriou health issu bodi mainli liver intestin produc cholesterol also come food eat,1
Mutize makes triumphant return to Sofar Sounds Harare’s 18th edition,https://www.theindependent.co.zw/lifestyle-amp-arts/article/200040390/mutize-makes-triumphant-return-to-sofar-sounds-harares-18th-edition,Arts/Culture/Celebrities,Independent,mutiz make triumphant return sofar sound harar 18th edit music enthusiast follow harar chapter global activ music event startup flock tudor valley guest hous watch care curat artist lineup,1
"Hair, hustle and high society: The Hairdresser of Harare",https://www.theindependent.co.zw/lifestyle-amp-arts/article/200040123/hair-hustle-and-high-society-the-hairdresser-of-harare,Arts/Culture/Celebrities,Independent,hair hustl high societi hairdress harar happen queen salon suddenli find dethron citi competit matter surviv,1
"Commitment, investment key to ending TB epidemic",https://www.theindependent.co.zw/lifestyle-amp-arts/article/200040124/commitment-investment-key-to-ending-tb-epidemic,Arts/Culture/Celebrities,Independent,commit invest key end tb epidem manema said tb remain lead caus death zimbabw mortal rate 33 per 100 000 exclud hiv tb,3
Film festival celebrates women,https://www.theindependent.co.zw/lifestyle-amp-arts/article/200040122/film-festival-celebrates-women,Arts/Culture/Celebrities,Independent,film festiv celebr women mark 10th edit film fiesta run may 30 june 8 main event set take place harar bulawayo,1
Good oral hygiene contributes towards one’s overall health,https://www.theindependent.co.zw/lifestyle-amp-arts/article/200039759/good-oral-hygiene-contributes-towards-ones-overall-health,Arts/Culture/Celebrities,Independent,good oral hygien contribut toward one overal health gum diseas also known periodont diseas chronic bacteri infect affect gum bone support teeth,3
Matobo’s earth colours inspire fashion and lifestyle trends,https://www.theindependent.co.zw/lifestyle-amp-arts/article/200039755/matobos-earth-colours-inspire-fashion-and-lifestyle-trends,Arts/Culture/Celebrities,Independent,matobo earth colour inspir fashion lifestyl trend later incorpor andré van rooyen clifford zulu violet ki tui butholezw nyathi initi,1
Early detection and treatment of kidney disease helps prognosis,https://www.theindependent.co.zw/lifestyle-amp-arts/article/200039527/early-detection-and-treatment-of-kidney-disease-helps-prognosis,Arts/Culture/Celebrities,Independent,earli detect treatment kidney diseas help prognosi also genet disord call polycyst kidney diseas caus cyst kidney,1
‘How to save Africa’s elephants’,https://www.theindependent.co.zw/lifestyle-amp-arts/article/200039526/how-to-save-africas-elephants,Arts/Culture/Celebrities,Independent,save africa eleph research show maintain current eleph number let alon revers declin requir new think conserv innov,0
Mavros inspires designers at Creative Economy fiesta,https://www.theindependent.co.zw/lifestyle-amp-arts/article/200039525/mavros-inspires-designers-at-creative-economy-fiesta,Arts/Culture/Celebrities,Independent,mavro inspir design creativ economi fiesta orchestr effort like skill conductor harmonis craftsmanship artistri,3
"Diet and exercise crucial for avoiding, managing diabetes",https://www.theindependent.co.zw/lifestyle-amp-arts/article/200039214/diet-and-exercise-crucial-for-avoiding-managing-diabetes,Arts/Culture/Celebrities,Independent,diet exercis crucial avoid manag diabet mungiria said diabet avoid sugari drink process food highfat food refin carbohydr,0
‘I aspire to be like water’: The exquisite prize-winning buildings of Liu Jiakun,https://www.theindependent.co.zw/lifestyle-amp-arts/article/200039213/i-aspire-to-be-like-water-the-exquisite-prize-winning-buildings-of-liu-jiakun,Arts/Culture/Celebrities,Independent,aspir like water exquisit prizewin build liu jiakun also requir patienc took 15 year see novel publish china,0
Nhaka to open exhibition to celebrate women solidarity,https://www.theindependent.co.zw/lifestyle-amp-arts/article/200039212/nhaka-to-open-exhibition-to-celebrate-women-solidarity,Arts/Culture/Celebrities,Independent,nhaka open exhibit celebr women solidar organis said exhibit celebr strength resili solidar women corner globe,0
The House of Hunger: Visceral mania of psychic fragmentation,https://www.theindependent.co.zw/lifestyle-amp-arts/article/200039040/the-house-of-hunger-visceral-mania-of-psychic-fragmentation,Arts/Culture/Celebrities,Independent,hous hunger viscer mania psychic fragment hous hunger serv brutal explor ideolog landscap zimbabw coloni liber period,1
World-class DJ fest returns to Harare,https://www.theindependent.co.zw/lifestyle-amp-arts/article/200039039/world-class-dj-fest-returns-to-harare,Arts/Culture/Celebrities,Independent,worldclass dj fest return harar set take place may 17 12hour dj extravaganza promis largest djdriven event countri,1
"Hypertension manageable with lifestyle choices, medical care",https://www.theindependent.co.zw/lifestyle-amp-arts/article/200039038/hypertension-manageable-with-lifestyle-choices-medical-care,Arts/Culture/Celebrities,Independent,hypertens manag lifestyl choic medic care blood pressur defin condit forc blood wall arteri consist high,0
